{
  "$schema": "../../libs/shared/contracts/assets/supply-chain-inventory.schema.json",
  "schemaVersion": 2,
  "status": "ACTIVE",
  "activationTask": "P03-PR3部署供应链",
  "productionNetwork": "offline",
  "assets": [
    {
      "id": "kit:computer-use",
      "kind": "kit",
      "sourcePath": "src/main/computerUse/computerUseRuntime.ts",
      "source": "repository:built-in-kit",
      "version": "1.0.7",
      "integrity": "sha256:1ce99c09a4a1848b796ab8210a92af4127c198da865a698a8a3eb330ff8aa236",
      "license": "repository-license",
      "scanStatus": "platform-reviewed",
      "productionEligible": false,
      "optional": true
    },
    {
      "id": "mcp-package:canva",
      "kind": "mcp-package",
      "sourcePath": "src/renderer/data/mcpRegistry.json",
      "source": "@iflow-mcp/mattcoatsworth-canva-mcp-server",
      "version": "UNPINNED",
      "integrity": "sha256:7dbf021d016ec9f965a876c2bd5cd0bad6481f17ffd731d9381a6bb13bcdc79c",
      "license": "registry-metadata-required",
      "scanStatus": "blocked",
      "productionEligible": false,
      "optional": true
    },
    {
      "id": "mcp-package:context7",
      "kind": "mcp-package",
      "sourcePath": "src/renderer/data/mcpRegistry.json",
      "source": "@upstash/context7-mcp",
      "version": "latest",
      "integrity": "sha256:2f32ef0e5e40c60706e6abd4a3cf52734597d30c6745f68ba3363aa72ff1f1cf",
      "license": "registry-metadata-required",
      "scanStatus": "blocked",
      "productionEligible": false,
      "optional": true
    },
    {
      "id": "mcp-package:fetch",
      "kind": "mcp-package",
      "sourcePath": "src/renderer/data/mcpRegistry.json",
      "source": "@modelcontextprotocol/server-fetch",
      "version": "UNPINNED",
      "integrity": "sha256:2cb6a340bf2eb6521bb37c8baee416b16e410bf3590591ea20ea5f4ccd5b286f",
      "license": "registry-metadata-required",
      "scanStatus": "blocked",
      "productionEligible": false,
      "optional": true
    },
    {
      "id": "mcp-package:figma",
      "kind": "mcp-package",
      "sourcePath": "src/renderer/data/mcpRegistry.json",
      "source": "figma-developer-mcp",
      "version": "latest",
      "integrity": "sha256:acef59bbe8c521021a77194cb1fff62ad65bb6c31e90fcd81bd37001be7d8d5a",
      "license": "registry-metadata-required",
      "scanStatus": "blocked",
      "productionEligible": false,
      "optional": true
    },
    {
      "id": "mcp-package:firecrawl",
      "kind": "mcp-package",
      "sourcePath": "src/renderer/data/mcpRegistry.json",
      "source": "firecrawl-mcp",
      "version": "latest",
      "integrity": "sha256:d2774314d4006db696913ff58590e3065f8c38a4faa1201b89e32e1ee02248d0",
      "license": "registry-metadata-required",
      "scanStatus": "blocked",
      "productionEligible": false,
      "optional": true
    },
    {
      "id": "mcp-package:github",
      "kind": "mcp-package",
      "sourcePath": "src/renderer/data/mcpRegistry.json",
      "source": "@modelcontextprotocol/server-github",
      "version": "UNPINNED",
      "integrity": "sha256:cb61ce9b47f746585a20ef0a23e3c5cdd24739e89a0908037e8ec72325af23bd",
      "license": "registry-metadata-required",
      "scanStatus": "blocked",
      "productionEligible": false,
      "optional": true
    },
    {
      "id": "mcp-package:gitlab",
      "kind": "mcp-package",
      "sourcePath": "src/renderer/data/mcpRegistry.json",
      "source": "@modelcontextprotocol/server-gitlab",
      "version": "UNPINNED",
      "integrity": "sha256:b8601569c65121e673fec84db1df23ea4c2513b43bf2074993b48b6ebdf58197",
      "license": "registry-metadata-required",
      "scanStatus": "blocked",
      "productionEligible": false,
      "optional": true
    },
    {
      "id": "mcp-package:gmail",
      "kind": "mcp-package",
      "sourcePath": "src/renderer/data/mcpRegistry.json",
      "source": "@gongrzhe/server-gmail-autoauth-mcp",
      "version": "UNPINNED",
      "integrity": "sha256:ea5a1258a3dbdb8eb199dab216374d5d09ab5ce5731dd90e920ceae313c8890b",
      "license": "registry-metadata-required",
      "scanStatus": "blocked",
      "productionEligible": false,
      "optional": true
    },
    {
      "id": "mcp-package:google-calendar",
      "kind": "mcp-package",
      "sourcePath": "src/renderer/data/mcpRegistry.json",
      "source": "@cocal/google-calendar-mcp",
      "version": "UNPINNED",
      "integrity": "sha256:e807507914f6cf32a31f60d996f51a5128a9fae2b1731856823bc49d4280af63",
      "license": "registry-metadata-required",
      "scanStatus": "blocked",
      "productionEligible": false,
      "optional": true
    },
    {
      "id": "mcp-package:google-drive",
      "kind": "mcp-package",
      "sourcePath": "src/renderer/data/mcpRegistry.json",
      "source": "@modelcontextprotocol/server-gdrive",
      "version": "UNPINNED",
      "integrity": "sha256:9554ca7b9b74bce840f591676741628dfde8a564f421d65e91cff1b9022b211d",
      "license": "registry-metadata-required",
      "scanStatus": "blocked",
      "productionEligible": false,
      "optional": true
    },
    {
      "id": "mcp-package:notion",
      "kind": "mcp-package",
      "sourcePath": "src/renderer/data/mcpRegistry.json",
      "source": "@notionhq/notion-mcp-server",
      "version": "UNPINNED",
      "integrity": "sha256:b6814768c18b2f849b9669255e21f15c3ebdada44c47ba5dce8d913a3a701e5d",
      "license": "registry-metadata-required",
      "scanStatus": "blocked",
      "productionEligible": false,
      "optional": true
    },
    {
      "id": "mcp-package:playwright",
      "kind": "mcp-package",
      "sourcePath": "src/renderer/data/mcpRegistry.json",
      "source": "@executeautomation/playwright-mcp-server",
      "version": "UNPINNED",
      "integrity": "sha256:180c9d567368c6e7a4dc827d809af864b3b6372d4530869f213f86726ed1d3a5",
      "license": "registry-metadata-required",
      "scanStatus": "blocked",
      "productionEligible": false,
      "optional": true
    },
    {
      "id": "mcp-package:slack",
      "kind": "mcp-package",
      "sourcePath": "src/renderer/data/mcpRegistry.json",
      "source": "@modelcontextprotocol/server-slack",
      "version": "UNPINNED",
      "integrity": "sha256:e80b9f1496e63bfa07e11150db30fe5bf99cd810bfdce54f4ce04cab1cd3e177",
      "license": "registry-metadata-required",
      "scanStatus": "blocked",
      "productionEligible": false,
      "optional": true
    },
    {
      "id": "mcp-package:tavily",
      "kind": "mcp-package",
      "sourcePath": "src/renderer/data/mcpRegistry.json",
      "source": "tavily-mcp",
      "version": "latest",
      "integrity": "sha256:80caf4f8dd895e28d0aa3b7e80d28f8942186ec0f8566905abc806d60cb8c45e",
      "license": "registry-metadata-required",
      "scanStatus": "blocked",
      "productionEligible": false,
      "optional": true
    },
    {
      "id": "mcp-package:todoist",
      "kind": "mcp-package",
      "sourcePath": "src/renderer/data/mcpRegistry.json",
      "source": "todoist-mcp",
      "version": "latest",
      "integrity": "sha256:6f7443f3e4ab4e17869309e944e069c8a93ddbd1e78a7879eea17d0570317dc4",
      "license": "registry-metadata-required",
      "scanStatus": "blocked",
      "productionEligible": false,
      "optional": true
    },
    {
      "id": "openclaw-extension:ask-user-question",
      "kind": "openclaw-extension",
      "sourcePath": "openclaw-extensions/ask-user-question/openclaw.plugin.json",
      "source": "repository:openclaw-extension",
      "version": "1.0.0",
      "integrity": "sha256:086d00d1ec89e593548fbc69c038976b4a8462818618fa14df332aa576a65843",
      "license": "repository-license",
      "scanStatus": "platform-reviewed",
      "productionEligible": true,
      "optional": false
    },
    {
      "id": "openclaw-extension:lobster-media-generation",
      "kind": "openclaw-extension",
      "sourcePath": "openclaw-extensions/lobster-media-generation/openclaw.plugin.json",
      "source": "repository:openclaw-extension",
      "version": "1.0.0",
      "integrity": "sha256:9517eaef3fa636a70f44ab0b6f0ccddb5dcaa23b7af5e0331883425e6326e4cf",
      "license": "repository-license",
      "scanStatus": "platform-reviewed",
      "productionEligible": true,
      "optional": false
    },
    {
      "id": "openclaw-extension:mcp-bridge",
      "kind": "openclaw-extension",
      "sourcePath": "openclaw-extensions/mcp-bridge/openclaw.plugin.json",
      "source": "repository:openclaw-extension",
      "version": "0.0.0",
      "integrity": "sha256:37eb0a28ae3950dca207ea4446720935e59a40e12f7ccbb3b10d632bff10cefc",
      "license": "repository-license",
      "scanStatus": "platform-reviewed",
      "productionEligible": true,
      "optional": false
    },
    {
      "id": "openclaw-plugin:clawemail-email",
      "kind": "openclaw-plugin",
      "sourcePath": "package.json",
      "source": "@clawemail/email",
      "version": "0.9.12",
      "integrity": "sha256:ebcba6de3280204da13e959a2539fce503dbc0bb519c33a6f0fc61792451ae2d",
      "license": "registry-metadata-required",
      "scanStatus": "platform-reviewed",
      "productionEligible": true,
      "optional": false
    },
    {
      "id": "openclaw-plugin:dingtalk-connector",
      "kind": "openclaw-plugin",
      "sourcePath": "package.json",
      "source": "@dingtalk-real-ai/dingtalk-connector",
      "version": "0.8.23",
      "integrity": "sha256:317c6cf04220a8596031a6a6284e83fc75c3427d752825e0b3b870da04269873",
      "license": "registry-metadata-required",
      "scanStatus": "platform-reviewed",
      "productionEligible": true,
      "optional": false
    },
    {
      "id": "openclaw-plugin:discord",
      "kind": "openclaw-plugin",
      "sourcePath": "package.json",
      "source": "@openclaw/discord",
      "version": "2026.6.1",
      "integrity": "sha256:6d936521d175931447169c9bef3d2a0b4756e3b180b0c5fe3353a94203994116",
      "license": "registry-metadata-required",
      "scanStatus": "platform-reviewed",